,title,yearPhDgraduation,phd_institution,curr_affiliation,curr_position,pub_affiliation,pub_position,name_corrections
178,"How Private Creditors Fared In Emerging Debt Markets, 1970-2000",1993.0,university of basel,university of  mainz,professor,university of mainz,professor,Beatrice Weder Di Mauro
179,International Portfolio Holdings And Swiss Franc Asset Returns,1993.0,university of basel,university of  mainz,professor,university of mainz,professor,Beatrice Weder Di Mauro
180,The Politics Of Debt Crises,1993.0,university of basel,university of  mainz,professor,university of mainz,professor,Beatrice Weder Di Mauro
181,German Bank Lending During Financial Crises: A Bank Level Analysis,1993.0,university of basel,university of  mainz,professor,university of mainz,professor,Beatrice Weder Di Mauro
182,Why Are Returns On Swiss Franc Assets So Low? Rare Events May Solve The Puzzle,1993.0,university of basel,university of  mainz,professor,university of mainz,professor,Beatrice Weder Di Mauro
183,Basel Ii And Bank Lending To Emerging Markets: Micro Evidence From German Banks,1993.0,university of basel,university of  mainz,professor,university of mainz,professor,Beatrice Weder Di Mauro
184,"International Competitiveness, Job Creation And Job Destruction - An Establishment Level Study Of German Job Flows",1993.0,university of basel,university of  mainz,professor,university of mainz,professor,Beatrice Weder Di Mauro
185,Reforming Global Governance: How To Make The Imf More Independent,1993.0,university of basel,university of  mainz,professor,university of mainz,professor,Beatrice Weder Di Mauro
186,"Offshoring, Firm Performance And Establishment-Level Employment: Identifying Productivity And Downsizing Effects",1993.0,university of basel,university of  mainz,professor,university of mainz,professor,Beatrice Weder Di Mauro
187,Real Effects Of Bank Governance: Bank Ownership And Corporate Innovation,1993.0,university of basel,university of  mainz,professor,university of mainz,professor,Beatrice Weder Di Mauro
188,The Plant-Level Employment Effect Of Offshoring: Evidence From Germany,1993.0,university of basel,university of  mainz,professor,university of mainz,professor,Beatrice Weder Di Mauro
189,Three Birds With One Stone: The G20 And Systemic Externalities,1993.0,university of basel,university of  mainz,professor,university of mainz,professor,Beatrice Weder Di Mauro
190,European Debt Restructuring Mechanism As A Tool For Crisis Prevention,1993.0,university of basel,university of  mainz,professor,university of mainz,professor,Beatrice Weder Di Mauro
191,A European Redemption Pact,1993.0,university of basel,university of  mainz,professor,university of mainz,professor,Beatrice Weder Di Mauro
192,"Manifesto For A Banking Union By Economists In Germany, Austria And Switzerland",1993.0,university of basel,university of  mainz,professor,university of mainz,professor,Beatrice Weder Di Mauro
193,Learning From Past Crises: Into The Safety Zone,1993.0,university of basel,university of  mainz,professor,university of mainz,professor,Beatrice Weder Di Mauro
194,Financial Sector Reform After The Crisis: Has Anything Happened?,1993.0,university of basel,university of  mainz,professor,university of mainz,professor,Beatrice Weder Di Mauro
195,The Wisdom Of Karlsruhe: The Omt Court Case Should Be Dismissed,1993.0,university of basel,university of  mainz,professor,university of mainz,professor,Beatrice Weder Di Mauro
196,A Rating Agency For Europe  A Good Idea?,1993.0,university of basel,university of  mainz,professor,university of mainz,professor,Beatrice Weder Di Mauro
197,A Rating Agency For Europe  A Good Idea?,1993.0,university of basel,university of  mainz,professor,university of mainz,professor,Beatrice Weder Di Mauro
198,How Have Financial Markets Reacted To Financial-Sector Reforms After The Crisis?,1993.0,university of basel,university of  mainz,professor,university of mainz,professor,Beatrice Weder Di Mauro
199,Revisiting Sovereign Bankruptcy,1993.0,university of basel,university of  mainz,professor,university of mainz,professor,Beatrice Weder Di Mauro
200,Orderly Debt Reduction Rather Than Permanent Mutualisation Is The Way To Go,1993.0,university of basel,university of  mainz,professor,university of mainz,professor,Beatrice Weder Di Mauro
201,Global Bank Lending Flows: Identifying The Flight Home Effect,1993.0,university of basel,university of  mainz,professor,university of mainz,professor,Beatrice Weder Di Mauro
202,Cepr Report: A New Start For The Eurozone: Dealing With Debt,1993.0,university of basel,university of  mainz,professor,university of mainz,professor,Beatrice Weder Di Mauro
203,Debt Sustainability Puzzles: Implications For Greece,1993.0,university of basel,university of  mainz,professor,university of mainz,professor,Beatrice Weder Di Mauro
204,Causes Of A Continuing Crisis: Not Dealing With Debt,1993.0,university of basel,university of  mainz,professor,university of mainz,professor,Beatrice Weder Di Mauro
205,Bail-In Expectations For European Banks: Actions Speak Louder Than Words,1993.0,university of basel,university of  mainz,professor,university of mainz,professor,Beatrice Weder Di Mauro
206,Cross-Border Resolution Regimes: Game-Theoretic Considerations,1993.0,university of basel,university of  mainz,professor,university of mainz,professor,Beatrice Weder Di Mauro
207,Eu Refugee Bonds,1993.0,university of basel,university of  mainz,professor,university of mainz,professor,Beatrice Weder Di Mauro
208,Reinforcing The Eurozone And Protecting An Open Society,1993.0,university of basel,university of  mainz,professor,university of mainz,professor,Beatrice Weder Di Mauro
209,"Private Shareholders, Governance Rules, And Central Bank Financial Behaviour",1993.0,university of basel,university of  mainz,professor,university of mainz,professor,Beatrice Weder Di Mauro
210,If You Really Want To Go  Germany And Brexit,1993.0,university of basel,university of  mainz,professor,university of mainz,professor,Beatrice Weder Di Mauro
211,How To Reconcile Risk Sharing And Market Discipline In The Euro Area,1993.0,university of basel,university of  mainz,professor,university of mainz,professor,Beatrice Weder Di Mauro
212,Putting The Greek Debt Problem To Rest,1993.0,university of basel,university of  mainz,professor,university of mainz,professor,Beatrice Weder Di Mauro
213,Making (Some) Sense Of Cryptocurrencies,1993.0,university of basel,university of  mainz,professor,university of mainz,professor,Beatrice Weder Di Mauro
214,Cryptocurrencies Challenge To Central Banks,1993.0,university of basel,university of  mainz,professor,university of mainz,professor,Beatrice Weder Di Mauro
215,Next Steps After The Euro Summit,1993.0,university of basel,university of  mainz,professor,university of mainz,professor,Beatrice Weder Di Mauro
216,Initial Coin Offerings: Fundamentally Different But Highly Correlated,1993.0,university of basel,university of  mainz,professor,university of mainz,professor,Beatrice Weder Di Mauro
217,Announcing The Cepr Women In Economics Initiative,1993.0,university of basel,university of  mainz,professor,university of mainz,professor,Beatrice Weder Di Mauro
218,"Euro Area Architecture: What Reforms Are Still Needed, And Why",1993.0,university of basel,university of  mainz,professor,university of mainz,professor,Beatrice Weder Di Mauro
219,The Benefits Of A Global Digital Currency,1993.0,university of basel,university of  mainz,professor,university of mainz,professor,Beatrice Weder Di Mauro
220,Economics In The Time Of Covid-19: A New Ebook,1993.0,university of basel,university of  mainz,professor,university of mainz,professor,Beatrice Weder Di Mauro
221,Covid-19: Europe Needs A Catastrophe Relief Plan,1993.0,university of basel,university of  mainz,professor,university of mainz,professor,Beatrice Weder Di Mauro
222,A Proposal For A Covid Credit Line,1993.0,university of basel,university of  mainz,professor,university of mainz,professor,Beatrice Weder Di Mauro
223,"New Cepr Publication: Covid Economics, Vetted And Real-Time Papers",1993.0,university of basel,university of  mainz,professor,university of mainz,professor,Beatrice Weder Di Mauro
224,Covid-19 Economic Crisis: Europe Needs More Than One Instrument,1993.0,university of basel,university of  mainz,professor,university of mainz,professor,Beatrice Weder Di Mauro
225,Repair And Reconstruct: A Recovery Initiative,1993.0,university of basel,university of  mainz,professor,university of mainz,professor,Beatrice Weder Di Mauro
226,A Debt Standstill For Covid-19 In Low- And Middle-Income Countries,1993.0,university of basel,university of  mainz,professor,university of mainz,professor,Beatrice Weder Di Mauro
227,Announcement: Covid Economics And Subsequent Submission To Journals,1993.0,university of basel,university of  mainz,professor,university of mainz,professor,Beatrice Weder Di Mauro
228,Europe in the time of Covid-19: A new eBook,1993.0,university of basel,university of  mainz,professor,university of mainz,professor,Beatrice Weder Di Mauro
229,Europe in the time of Covid-19: A new crash test and a new opportunity,1993.0,university of basel,university of  mainz,professor,university of mainz,professor,Beatrice Weder Di Mauro
230,In memory of Alberto Alesina,1993.0,university of basel,university of  mainz,professor,university of mainz,professor,Beatrice Weder Di Mauro
231,Sovereign debt standstills: An update,1993.0,university of basel,university of  mainz,professor,university of mainz,professor,Beatrice Weder Di Mauro
232,Cross-Border Resolution Of Global Banks: Bail In Under Single Point Of Entry Versus Multiple Points Of Entry,1993.0,university of basel,university of mainz,professor,university of mainz,professor,Beatrice Weder Di Mauro
233,"No Smoking Gun: Private Shareholders, Governance Rules And Central Bank Financial Behavior",1993.0,university of basel,university of mainz,professor,university of mainz,professor,Beatrice Weder Di Mauro
234,EU economic policy and architecture after Covid: Rebooting the debate on the EU reform roadmap,1989.0,university of basel,Graduate Institute of Geneva,Professor of International Economics,Graduate Institute of Geneva,Professor of International Economics,Beatrice Weder Di Mauro
235,Pricing of carbon within and at the border of Europe,1989.0,university of basel,Graduate Institute of Geneva,Professor of International Economics,Graduate Institute of Geneva,Professor of International Economics,Beatrice Weder Di Mauro
