,title,yearPhDgraduation,phd_institution,curr_affiliation,curr_position,pub_affiliation,pub_position,name_corrections
593,The Covid-19 Crisis And Consumption: Survey Evidence From Six Eu Countries,1998.0,dublin city university,european central bank,head of section,european central bank,head of section,Geoff Kenny
594,"Macroeconomic Stabilisation, The Lower Bound, And Inflation: Expectations Matter",1998.0,dublin city university,european central bank,head of section,european central bank,head of section,Geoff Kenny
595,The Effect of Macroeconomic Uncertainty on Household Spending,1998.0,dublin city university,european central bank,head of section,european central bank,head of section,Geoff Kenny
596,The Effect of Macroeconomic Uncertainty on Household Spending,1998.0,dublin city university,european central bank,head of section,european central bank,head of section,Geoff Kenny
597,Heterogenous effects of Covid-19 on households' financial situation and consumption,1998.0,dublin city university,european central bank,head of section,european central bank,head of section,Geoff Kenny
